,HydroID,BoreID,FromDepth,ToDepth,Description,Lithology_1,MajorLithCode
0,80000001,80000001,0.0,4.0,poorly sorted sands and minor gravel in dark grey to brown clay. minor leakage.,sand,None
1,80000001,80000001,4.0,34.0,dacite to rhyro-dacite. minor fracturing no water intersected,dacite,None
2,80000001,80000001,34.0,36.0,dacite to rhyro-dacite. carbonaceous zones with pyrite. minor water,dacite,None
3,80000001,80000001,48.0,60.0,dacite to rhyro-dacite. minor carbonaceous. major aquifer.,dacite,None
4,80000002,80000002,0.0,2.0,large pebbles with poorly sorted sands. major water loss during drilling with major cavity formed.,sand,None
5,80000002,80000002,2.0,36.0,dacite to rhyro-dacite. firm minor fracturing no major water intersected,dacite,None
6,80000002,80000002,36.0,60.0,"dacite to rhyro-dacite. water intersected, major zone below 40 metres",dacite,None
7,80000003,80000003,0.0,1.0,light grey silts and clay. no aquifer detected.,clay,None
8,80000003,80000003,1.0,18.0,dacite to rhyro-dacite. minor water intersected at 18.0 metres,dacite,None
9,80000003,80000003,18.0,32.0,dacite to rhyro-dacite.,dacite,None
10,80000003,80000003,32.0,60.0,dacite to rhyro-dacite. multiple fracture systems intersected with water,dacite,None
11,80000004,80000004,0.0,1.0,"grey clay, no water intersected. no aquifer detected.",clay,None
12,80000004,80000004,1.0,5.0,dacite. grading moderately to slightly weathered dacite.,dacite,None
13,80000004,80000004,5.0,80.0,"dacite, firm, dry, minor fracturing",dacite,None
14,80000004,80000004,80.0,84.0,"dacite, minor water intersected.",dacite,None
15,80000005,80000005,0.0,1.0,dark brown silty loam,,None
16,80000005,80000005,1.0,3.0,yellowish brown clayey coarse gravel; gravel clasts mostly weathered mudstone,gravel,None
17,80000005,80000005,3.0,4.0,black organic fine sandy silt,,None
18,80000005,80000005,4.0,9.0,"fine gravel, well sorted. grains 30% sub-rounded quartz, 70% sub-rounded and tabular shale rock fragments",gravel,None
19,80000005,80000005,9.0,12.0,"coarse sand, well sorted. grains 50% sub-rounded quartz, 50% sub-rounded shale and mudstone rock fragments",sand,None
20,80000005,80000005,12.0,13.0,"pre-cainozoic basement, silicified fine-grained volcanic rock? very hard",rock,None
21,80000006,80000006,0.0,1.0,red clay overlying yellowish brown plastic clay with weathered shale fragments,clay,None
22,80000006,80000006,1.0,2.0,yellowish brown weathered shale with claybands,shale,None
23,80000006,80000006,2.0,6.0,"pale pinkish brown shale; fissile, minor manganese staining",shale,None
24,80000006,80000006,6.0,7.0,"pale pinkish grey soft weathered mudstone, clayey",mudstone,None
25,80000006,80000006,7.0,9.0,"pale yellowish brown shale; fissile and fractured but dry, minor manganese staining on fracture faces",shale,None
26,80000006,80000006,9.0,11.0,pale pinkish grey shale,shale,None
27,80000006,80000006,11.0,14.0,pinkish grey shale with yellowish brown claybands,shale,None
28,80000006,80000006,14.0,15.0,yellowish brown shale with minor manganese staining,shale,None
29,80000006,80000006,15.0,16.0,pinkish brown shale,shale,None
30,80000006,80000006,16.0,17.0,yellowish brown mudstone; fractured with manganese staining on fracture faces; dry,mudstone,None
31,80000006,80000006,17.0,21.0,"yellowish brown shale, very fissile",shale,None
32,80000006,80000006,21.0,23.0,yellowish brown mudstone,mudstone,None
33,80000006,80000006,23.0,28.0,olive brown and olive grey shale; fissile,shale,None
34,80000006,80000006,28.0,30.0,"olive brown mudstone, fractured and dry",mudstone,None
35,80000006,80000006,30.0,31.0,yellowish grey mudstone with claybands; very soft,mudstone,None
36,80000006,80000006,31.0,32.0,"laminated grey and brown shales; fissile and fractured, dry",shale,None
37,80000006,80000006,32.0,38.0,"pale bluish grey shale, very fissile",shale,None
38,80000006,80000006,38.0,40.0,pale grey mudstone with claybands,mudstone,None
39,80000006,80000006,40.0,42.0,pale bluish grey shale with minor quartzite bands,shale,None
40,80000006,80000006,42.0,46.0,pale bluish mudstone with quartzite bands; fractured but dry 44-46m,mudstone,None
41,80000006,80000006,46.0,48.0,"bluish grey shale, trace quartzite bands, fissile",shale,None
42,80000006,80000006,48.0,49.0,bluish grey mudstone with quartzite bands; fractured with soak,mudstone,None
43,80000006,80000006,49.0,55.0,"bluish grey siltstone/mudstone; trace quartzite, moist fracture zone 53-55m",,None
44,80000006,80000006,55.0,57.0,bluish grey shale; fissile,shale,None
45,80000006,80000006,57.0,59.0,"bluish grey siltstone/mudstone, minor quartzite bands; fractured, moist",,None
46,80000006,80000006,59.0,60.0,"bluish grey shale, fissile",shale,None
47,80000006,80000006,60.0,84.0,"bluish grey siltstone/mudstone with quartzite veins; fractured and saturated. shaly bands 62-68 and 76-78m, minor pale brown siltstone bands 72-84m.",siltstone,None
48,80000007,80000007,0.0,1.0,"mottled yellowish brown and reddish brown clay, medium plasticity. abundant small iron-ferruginous nodules.",clay,None
49,80000007,80000007,1.0,2.0,"brown dense sandy clay, high plasticity.",clay,None
50,80000007,80000007,2.0,4.0,"yellowish brown grading to yellowish grey clay, high plasticity, well structured.",clay,None
51,80000007,80000007,4.0,15.0,"pale greyish brown highly to moderately weathered dacite, iron-ferruginous stains on most fracture faces.",dacite,None
52,80000007,80000007,15.0,19.0,pale grey slightly weathered dacite; moist zone 15-16m,dacite,None
53,80000007,80000007,19.0,23.0,"bluish grey fresh dacite; hard, chips 5-8mm.",dacite,None
54,80000007,80000007,23.0,25.0,"pale bluish grey and pale brownish grey fresh dacite; rock fine-grained, powdery chips.",dacite,None
55,80000007,80000007,25.0,31.0,"grey dacite, phenocrysts clearly visible; moist zone 25-28m.",dacite,None
56,80000007,80000007,31.0,65.0,bluish grey fresh dacite; hard and massive except for wet zone 55-56m.,dacite,None
57,80000007,80000007,65.0,90.0,"bluish grey fine-grained dacite; very hard and fresh, “shaly texture”; wet zone 72-73m. thin water bearing fracture zone at 80m.",dacite,None
58,80000008,80000008,0.0,1.0,brown sandy loam,,None
59,80000008,80000008,1.0,2.0,"yellowish grey sandy clay, medium plasticity",clay,None
60,80000008,80000008,2.0,4.0,"reddish brown and yellowish brown completely weathered dacite, minor claybands",dacite,None
61,80000008,80000008,4.0,6.0,"brown and purple moderately weathered dacite, hard and soft bands",dacite,None
62,80000008,80000008,6.0,7.0,yellowish brown moderately weathered dacite; powdery cuttings,dacite,None
63,80000008,80000008,7.0,57.0,purple and pale grey slightly weathered dacite; feldspar phenocrysts to 3mm; chips angular and blocky upper to 20mm; mostly hard with some softer bands,dacite,None
64,80000008,80000008,57.0,67.0,"pinkish grey and purple dacite; hard, flaky and angular chips upper to 10mm",dacite,None
65,80000008,80000008,67.0,78.0,"pinkish grey highly fractured dacite; water bearing, fracture faces extensively iron-stained, angular chips upper to 30mm",dacite,None
66,80000009,80000009,0.0,1.0,"thin loam overlying brown silty clay, medium plasticity",clay,None
67,80000009,80000009,1.0,2.0,"greyish brown clay, medium plasticity",clay,None
68,80000009,80000009,2.0,4.0,"brown fine sandy slopewash, weakly indurated",,None
70,80000009,80000009,4.0,6.0,greyish brown fine slopewash with grey claybands,,None
72,80000009,80000009,6.0,7.0,"greyish brown colluvium, angular rock fragments upper to 20mm",rock,None
73,80000009,80000009,7.0,8.0,greyish brown fine slopewash with brown claybands,,None
74,80000009,80000009,8.0,9.0,"bluish grey and purple slightly weathered ignimbrite, fractured and dry",ignimbrite,None
75,80000009,80000009,9.0,20.0,"greyish brown and purple highly weathered ignimbrite, most feldspars altered to sericite",ignimbrite,None
76,80000009,80000009,20.0,24.0,"purple and pale bluish grey moderately to highly weathered ignimbrite, hard and soft bands",ignimbrite,None
77,80000009,80000009,24.0,31.0,bluish grey highly weathered ignimbrite,ignimbrite,None
78,80000009,80000009,31.0,36.0,"bluish grey and greenish grey slightly to moderately weathered ignimbrite, highly fractured with blocky chips upper to 30mm",ignimbrite,None
79,80000010,80000010,0.0,1.0,dark brown clay/loam,,None
80,80000010,80000010,1.0,2.0,dark brown clay with minor rock fragments upper to 2mm,clay,None
81,80000010,80000010,2.0,3.0,yellowibrown loam with fragments of highly weathered tuff ( chips to 3mm),,None
82,80000010,80000010,3.0,9.0,moderately weathered brown/grey ignimbrite. quartz phenocrysts upper to 2mm.,ignimbrite,None
83,80000010,80000010,10.0,13.0,"fresh, dark grey dacitic ignimbrite. dark grey to black fine grained matrix. matrix has a frosted glass appearance when viewed with hand lens. quartz and mafic phenocrysts upper to 4mm",ignimbrite,None
84,80000010,80000010,13.0,14.0,moderately fractured dacitic ignimbrite. iron staining on fractured surfaces. chips upper to 12mm. minor water,ignimbrite,None
85,80000010,80000010,14.0,16.0,dry dacitic ignimbrite minor fracturing. secondary quartz evident along fracture planes,ignimbrite,None
86,80000010,80000010,16.0,28.0,moderately fractured dacitic ignimbrite. water intercept 16 – 17.,ignimbrite,None
87,80000010,80000010,29.0,37.0,highly fractured dacitic ignimbrite. chips upper to 60mm,ignimbrite,None
88,80000011,80000011,0.0,1.0,dark brown silty coarse gravel,gravel,None
89,80000011,80000011,1.0,5.0,"fine gravel, 50% rounded quartz, 50% rounded and tabular mudstone rock fragments",gravel,None
90,80000011,80000011,5.0,6.0,greyish brown silty clay,clay,None
91,80000011,80000011,6.0,23.0,"coarse sand - fine gravel, moderately well sorted. grains 60% sub-rounded quartz, 40% sub-rounded and tabular shale rock fragments. white claybands throughout. slight mud loss 22-23m",sand,None
92,80000011,80000011,23.0,24.0,"pre-cainozoic basement, grey mudstone, alternating hard and soft bands. large mud loss",mudstone,None
93,80000012,80000012,0.0,1.0,slope wash. brown clay/silt with angular occasional weathered rock fragments. sub rounded quartz upper to 3mm,rock,None
94,80000012,80000012,1.0,2.0,light brown loam/clay . mottled clay nodules derived from weathered rock fragments.,clay,None
95,80000012,80000012,2.0,3.0,"yellowibrown loam, few rock fragments",rock,None
96,80000012,80000012,3.0,4.0,moderately weathered brown/grey mudstone (fractured). secondary quartz and iron staining along fracture planes. chips to 5mm,mudstone,None
97,80000012,80000012,4.0,10.0,"as above. moderately fractured, chips to 20mm.",,None
98,80000012,80000012,10.0,11.0,reddish brown very fine grained quartzite.,,None
99,80000012,80000012,11.0,26.0,moderately fractured brown/grey siltstone.,siltstone,None
100,80000012,80000012,26.0,32.0,dark grey siltstone. moderately fractured with secondary quartz and some epidote? (pale green mineral) along fracture planes> iron staining on some fracture surfaces. chips upper to 10mm.,siltstone,None
101,80000012,80000012,32.0,33.0,"as above. increase in fracturing, chips upper to 15mm.",,None
102,80000012,80000012,33.0,60.0,"dark grey siltstone. minor brown/grey bands. minor fracturing, secondary quartz and iron staining present on fracture surfaces. chips to 6mm",siltstone,None
103,80000012,80000012,60.0,61.0,alternating grey siltstone and brown/grey mudstone. mudstone chips to 10mm. siltstone chips to 5mm.,siltstone,None
104,80000012,80000012,61.0,66.0,"dark grey siltstone, minor fracturing. chips to 7mm",siltstone,None
105,80000012,80000012,66.0,67.0,"alternating grey siltstone and grey/brown mudstone. moderately fractured, mudstone chip to 15mm",siltstone,None
106,80000012,80000012,67.0,69.0,moderately fractured dark grey siltstone. chips to 10mm,siltstone,None
107,80000012,80000012,69.0,70.0,moderately fractured brown/grey mudstone alternating with grey siltstone. iron staining on fracture surfaces. chips upper to 15mm,mudstone,None
108,80000012,80000012,70.0,72.0,dark grey siltstone with minor bands of brown/grey mudstone. overall decrease in fracturing.,siltstone,None
109,80000012,80000012,72.0,74.0,"brown/grey mudstone. moderately fractured, chips to 15mm.",mudstone,None
110,80000012,80000012,74.0,79.0,"dark grey siltstone, minor fracturing.",siltstone,None
111,80000013,80000013,0.0,1.0,red/brown clay with silt to coarse sand grains,clay,None
112,80000013,80000013,1.0,2.0,light brown clay with silt to coarse sand sized grains. includes angular quartz grains,clay,None
113,80000013,80000013,2.0,19.0,yellowibrown clay/loam matrix (> 80%) containing highly weathered dacitic ignimbrite. abundant angular coarse sand sized quartz grains and weathered dacitic ignimbrite fragments. damp,ignimbrite,None
114,80000013,80000013,19.0,20.0,moist cohesive yellowibrown clay withy highly weather dacitic fragments,clay,None
115,80000013,80000013,20.0,25.0,slightly weathered light grey dacitic ignimbrite with occasional pale grey clay nodules. minor iron staining on fracture planes. chips upper to 8mm. average 3mm. water intercepted at 22m,ignimbrite,None
116,80000013,80000013,25.0,28.0,"fresh dacitic ignimbrite, occasional more felsic highly weathered chips displaying iron staining on fracture planes.",ignimbrite,None
117,80000013,80000013,28.0,29.0,moderately fracture dacitic ignimbrite. chips upper to 15mm,ignimbrite,None
118,80000013,80000013,30.0,37.0,moderately fractured dacitic ignimbrite containing felsic moderately weathered xenoliths. chips upper to 30mm.,ignimbrite,None
119,80000014,80000014,0.0,1.0,"brown sandy clay, medium plasticity",clay,None
120,80000014,80000014,1.0,3.0,reddish brown fine clayey slopewash,,None
121,80000014,80000014,3.0,4.0,"reddish brown sandy slopewash; volcanic rock fragments upper to 5mm, minor claybands, moist",rock,None
122,80000014,80000014,4.0,5.0,reddish brown fine slopewash with claybands; seepage,,None
123,80000014,80000014,5.0,6.0,reddish brown and yellowish brown fine slopewash with yellowish brown claybands; seepage,,None
124,80000014,80000014,6.0,7.0,yellowish brown and purple sandy slopewash; seepage,,None
125,80000014,80000014,7.0,8.0,reddish and yellowish brown fine gravely slopewash; seepage,,None
126,80000014,80000014,8.0,10.0,yellowish brown and reddish brown sandy slopewash; seepage,,None
127,80000014,80000014,10.0,11.0,yellowish brown sandy slopewash with claybands; seepage,,None
128,80000014,80000014,11.0,13.0,reddish brown indurated sandy slopewash,,None
129,80000014,80000014,13.0,18.0,greenish grey moderately weathered dacitic tuff; dry fracture zones 15-16 and 17-18m,,None
130,80000014,80000014,18.0,22.0,greenish grey slightly weathered dacitic tuff; trace pyrite 18-20m,,None
131,80000014,80000014,22.0,48.0,bluish grey fresh dacitic tuff; quartz and plagioclase phenocrysts 2-3mm,,None
132,80000014,80000014,48.0,51.0,"dark blue gray dacitic tuff, fracture zone (chips upper to 5cm). iron staining on fracture planes. minor water intercept.",,None
133,80000014,80000014,51.0,56.0,"dark blue grey dacitic tuff, quarts phenocrysts upper to 1.5mm. little if any fracturing – dry.",,None
134,80000014,80000014,56.0,67.0,"grey, uniformly fine grained ashstone. chips elongated in one plane ( upper to 3cm). minor bands of black coarse grained tuff containing minor pyrite and quartz phenocrysts upper to 1mm. water intercept at 60m",,None
135,80000014,80000014,67.0,70.0,as above. minor fracturing indicated by iron staining on 5% of chips,,None
136,80000014,80000014,70.0,79.0,"grey, uniformly fine grained ashstone. no evidence of fracturing",,None
137,80000014,80000014,79.0,84.0,"alternating bands of grey and light grey, ashstone. iron stained quartz chips upper to 1.5mm",,None
138,80000014,80000014,84.0,87.0,as above. increase in chip size (upper to 10mm). moderately fractured. increase in amount of iron iron stained quartz chips,,None
139,80000014,80000014,87.0,90.0,"grey, uniformly fine grained ashstone. minor fracturing",,None
140,80000015,80000015,0.0,1.0,red/brown mottled clay containing weathered coarse sand sized rock fragments.,clay,None
141,80000015,80000015,1.0,2.0,light brown/cream highly weathered rock fragments almost completely weathered to clay.,rock,None
142,80000015,80000015,2.0,14.0,orange/light brown highly weathered dacitic ignimbrite. some fragments moderately weathered. iron staining along fracture planes. moderately fractured.,ignimbrite,None
143,80000015,80000015,14.0,19.0,"highly weathered dacitic ignimbrite, feldspar altered to clay on fracture surfaces. quartz phenocrysts upper to 3mm. highly fractured, chips upper to 30mm. iron staining on fracture surfaces. water intercepted at 15m.",ignimbrite,None
144,80000016,80000016,0.0,1.0,red/brown loamy clay with silt to coarse sand grains,clay,None
145,80000016,80000016,1.0,3.0,yellowibrown clay loam with occasion al sand and pebble sized grains.,clay,None
146,80000016,80000016,3.0,4.0,yellowibrown clay containing a combination of angular coarse sand and subrounded to rounded pebbles upper to 10mm in length.,clay,None
147,80000016,80000016,4.0,8.0,as above. increase in pebble size upper to 15mm. water intercept 5m,,None
148,80000016,80000016,8.0,13.0,"alluvium, poorly sorted containing a combination of angular coarse sand and subrounded to rounded pebbles upper to 50mm in length.",sand,None
150,80000031,80000031,0.0,1.0,decomposed porphyry,porphyry,None
152,80000031,80000031,1.0,2.0,lightly weathered quartz porphyry,porphyry,None
154,80000033,80000033,0.0,1.0,"clay, soil",clay,None
156,80000033,80000033,1.0,3.0,porphyry,porphyry,None
158,80000034,80000034,0.0,2.0,very weathered porphyry with residual bars of fresh porphyry,porphyry,None
161,80000034,80000034,2.0,4.0,hard blue porphyry,porphyry,None
163,80000037,80000037,0.0,1.0,weathered porphyry,porphyry,None
164,80000037,80000037,1.0,2.0,brown shale & mudstone (fossilif),shale,None
167,80000037,80000037,2.0,4.0,black hornfalsed mudstone (some porphyry 135-138ft),mudstone,None
168,80000037,80000037,4.0,5.0,hard siliceous porphyry with thin calcite veins.  possible fracture reported by driller at 180',porphyry,None
170,80000038,80000038,0.0,1.0,weathered porphyry,porphyry,None
172,80000038,80000038,1.0,2.0,increasingly hard fresh silicified porphyry,porphyry,None
176,80000039,80000039,0.0,1.0,hard porphyry,porphyry,None
178,80000043,80000043,0.0,3.0,clay,clay,None
179,80000043,80000043,3.0,5.0,shale,shale,None
180,80000043,80000043,5.0,14.0,sandstone,sandstone,None
181,80000043,80000043,14.0,18.0,unknown,,None
183,80000047,80000047,0.0,1.0,weathered porphyry,porphyry,None
187,80000048,80000048,0.0,1.0,black soil,soil,None
188,80000048,80000048,1.0,6.0,weathered porphyry,porphyry,None
189,80000048,80000048,6.0,7.0,hard porphyry,porphyry,None
190,80000048,80000048,7.0,9.0,weathered porphyry,porphyry,None
191,80000048,80000048,9.0,13.0,hard and soft porphyry,porphyry,None
192,80000048,80000048,13.0,16.0,slightly weathered porphyry,porphyry,None
193,80000048,80000048,16.0,17.0,weathered porphyry,porphyry,None
194,80000048,80000048,17.0,30.0,slightly weathered porphyry with more weathered bands,porphyry,None
195,80000049,80000049,0.0,4.0,"clay, finegravel",clay,None
196,80000049,80000049,4.0,5.0,"coarse sand, clay",sand,None
198,80000049,80000049,5.0,9.0,"clay, weathered shale",clay,None
199,80000049,80000049,9.0,27.0,"weathered shale, siltstone",shale,None
200,80000056,80000056,0.0,5.0,granite alluvium and soil,granite,None
201,80000056,80000056,5.0,18.0,deeply weathered granite porphyry,granite,None
202,80000056,80000056,18.0,32.0,less weathered granite porphyry,granite,None
203,80000056,80000056,32.0,37.0,fresh granite porphyry,granite,None
204,80000060,80000060,0.0,13.0,clay orangish mud,clay,None
205,80000060,80000060,13.0,16.0,sands on sandy clay,sand,None
215,80000097,80000097,0.0,3.0,brown clay,clay,None
216,80000097,80000097,3.0,5.0,brown clay,clay,None
217,80000097,80000097,5.0,6.0,pisolitic fine,,None
218,80000097,80000097,6.0,7.0,"heavy white clay, sand and gravel",clay,None
219,80000097,80000097,7.0,9.0,fine shaly gravel,gravel,None
220,80000097,80000097,9.0,11.0,fine shaley,,None
221,80000097,80000097,11.0,14.0,mno2 slained,,None
222,80000097,80000097,14.0,20.0,weathered shale,shale,None
223,80000097,80000097,20.0,31.0,reddish brown shale,shale,None
224,80000097,80000097,31.0,39.0,brown clay,clay,None
225,80000097,80000097,39.0,45.0,weathered shale,shale,None
226,80000099,80000099,0.0,1.0,yellow soil including wash and floaters,soil,None
227,80000099,80000099,1.0,4.0,blackish soil and polymict rock fragments,soil,None
228,80000099,80000099,4.0,5.0,"weathered fragments of silicified sandstone, siltstone and volcanics",sandstone,None
229,80000099,80000099,5.0,8.0,heavy yellow clay and rock fragments,clay,None
230,80000099,80000099,8.0,12.0,slightly weathered siltstone and shale,siltstone,None
231,80000099,80000099,12.0,28.0,"slightly weathered, partly silicified siltstone and shale",siltstone,None
232,80000099,80000099,28.0,69.0,"fresh, slightly siltstone and shale",siltstone,None
233,80000103,80000103,0.0,1.0,white clayey silt,,None
234,80000103,80000103,1.0,2.0,yellow brown mottled sandy clay,clay,None
235,80000103,80000103,2.0,3.0,yellow brown mottled clayey sand (extremely weathered sandstone),sand,None
236,80000103,80000103,3.0,5.0,extremely highly weathered sandstone,sandstone,None
237,80000104,80000104,0.0,2.0,yellow brown mottled sandy clay,clay,None
238,80000104,80000104,2.0,3.0,grey brown silty clay (extremely weathered mudstone),clay,None
239,80000104,80000104,3.0,6.0,extremely weathered mudstone,mudstone,None
240,80000105,80000105,0.0,3.0,yellow brown mottled sandy clay,clay,None
241,80000105,80000105,3.0,6.0,yellow brown clayey sand (extremely weathered volcanic rock),sand,None
242,80000106,80000106,0.0,2.0,light brown sandy clay,clay,None
243,80000106,80000106,2.0,3.0,brown sandy gravelly clay,clay,None
244,80000106,80000106,3.0,6.0,light brown clayey sand (extremely weathered volcanic rock),sand,None
246,80000107,80000107,0.0,4.0,sandy clay,clay,None
247,80000107,80000107,0.0,4.0,heavy clay with priobtes in part,clay,None
249,80000107,80000107,4.0,6.0,clay with gravel (water bearing),clay,None
250,80000107,80000107,4.0,5.0,no core,,None
252,80000107,80000107,5.0,9.0,highly weathered to extremely weathered daute porphyry,porphyry,None
253,80000107,80000107,6.0,18.0,quartzie clay,clay,None
254,80000107,80000107,9.0,16.0,highly weathered daute,,None
255,80000107,80000107,16.0,18.0,moderately weathered multi grained to fine grained dacite,dacite,None
256,80000107,80000107,18.0,21.0,clay with hard bands,clay,None
257,80000107,80000107,21.0,25.0,yellow clay with hard bands,clay,None
258,80000107,80000107,25.0,28.0,yellow clay,clay,None
259,80000107,80000107,28.0,34.0,yellow sandy clay,clay,None
260,80000107,80000107,34.0,35.0,clay pinkgk,clay,None
261,80000107,80000107,35.0,38.0,slight,,None
262,80000107,80000107,38.0,39.0,coarse sandstone,sandstone,None
263,80000107,80000107,39.0,49.0,coarse sandstone,sandstone,None
264,80000107,80000107,49.0,53.0,sandy clay and quartz,clay,None
265,80000107,80000107,53.0,63.0,soft sandstone,sandstone,None
266,80000107,80000107,63.0,64.0,sandstone,sandstone,None
267,80000107,80000107,64.0,70.0,sandy clay,clay,None
268,80000126,80000126,0.0,3.0,soil,soil,None
269,80000126,80000126,3.0,5.0,"soil, scree and rotten granite",soil,None
270,80000126,80000126,5.0,14.0,strongly weathered granite,granite,None
271,80000126,80000126,14.0,21.0,"granite, considerably weathered",granite,None
272,80000126,80000126,21.0,30.0,slightly weathered granite.  granite with some zones of considerably weathered.,granite,None
273,80000126,80000126,30.0,34.0,slightly weathered granite,granite,None
274,80000126,80000126,34.0,41.0,fresh biotite granite,granite,None
277,80000148,80000148,0.0,1.0,"green quartz, feldspar, porphryry",,None
282,80000148,80000148,1.0,2.0,"brown, weathered quartz feldspar porphryry",,None
286,80000148,80000148,2.0,3.0,"green quartz, feldspar, porphyry",porphyry,None
287,80000150,80000150,0.0,5.0,decomposing shale (tough clayey shale),shale,None
288,80000150,80000150,5.0,19.0,blue shale,shale,None
289,80000152,80000152,0.0,2.0,soil - fine grained acid volcanics (thin); blue grey shale,soil,None
292,80000153,80000153,0.0,1.0,pale yellow grey sandy clay,clay,None
296,80000153,80000153,1.0,2.0,weathered porphyry,porphyry,None
299,80000156,80000156,0.0,1.0,slate and greywacke siltstone with weathered zones near top.  few iron stained quartz grains,slate,None
301,80000156,80000156,1.0,2.0,quartz sandstone and siltstone greywacke,sandstone,None
302,80000167,80000167,0.0,9.0,sandy and gravelly clay,clay,None
303,80000167,80000167,9.0,18.0,weathered granite (quartz feldspar porphyry),granite,None
304,80000190,80000190,0.0,12.0,"sandy clay, yellow brown",clay,None
305,80000190,80000190,12.0,17.0,"wet clay, grey brown",clay,None
306,80000190,80000190,17.0,20.0,"quartz, grey shale",shale,None
307,80000190,80000190,20.0,24.0,fine to medium shale,shale,None
308,80000190,80000190,24.0,32.0,medium to coarse grained shale,shale,None
309,80000190,80000190,32.0,43.0,very fine shale,shale,None
310,80000190,80000190,43.0,49.0,coarse grained shale,shale,None
311,80000190,80000190,49.0,61.0,siltstone and shale,siltstone,None
312,80000190,80000190,61.0,76.0,"shale, fine grained sandstone",shale,None
313,80000190,80000190,76.0,93.0,"shale, quartz",shale,None
314,80000194,80000194,0.0,5.0,clay and sand,clay,None
315,80000194,80000194,5.0,15.0,gravel and sand,gravel,None
322,80000200,80000200,0.0,1.0,"quartz, pyrite, micaeous",,None
326,80000200,80000200,1.0,2.0,moderately weathered volcanic fragments and pyrite cubes,,None
327,80000227,80000227,0.0,2.0,moderately weathered to highly weathered sedimentary rock with perty.  could be shale orangish weathered fine grained waterland tuff,rock,None
